{
  "$schema": "https://json-schema.org/draft/2020-12/schema",
  "$id": "https://tabbi.app/schemas/themes.v1.schema.json",
  "title": "Tabbi themes (themes.v1)",
  "description": "Sources/TabbiKitCore/Themes/themes.json: every theme of the open panel in picker order, the default theme, kit theme values from before themes existed, and the light drawn on glass surfaces. The closed notch is pure black in every theme. What the enum values do (accent treatments, gentle motion, glass) is code, pinned by shared/fixtures/themes/themes.json.",
  "type": "object",
  "required": ["schema", "defaultTheme", "legacyKitThemes", "glassSheen", "themes"],
  "additionalProperties": false,
  "properties": {
    "schema": { "const": "themes.v1" },
    "defaultTheme": { "description": "The theme used when neither settings nor a kit picks one.", "$ref": "#/$defs/id" },
    "legacyKitThemes": {
      "description": "Old values of a kit's theme field, to the theme they mean.",
      "type": "object",
      "additionalProperties": { "$ref": "#/$defs/id" }
    },
    "glassSheen": {
      "description": "The drawn light of a glass card: a fill brighter at the top, a glint near the top-leading corner that fades toward the middle, and a rim lit from above.",
      "type": "object",
      "required": ["fillTop", "fillBottom", "glint", "rimTop", "rimBottom"],
      "additionalProperties": false,
      "properties": {
        "fillTop": { "$ref": "#/$defs/color" },
        "fillBottom": { "$ref": "#/$defs/color" },
        "glint": { "$ref": "#/$defs/color" },
        "rimTop": { "$ref": "#/$defs/color" },
        "rimBottom": { "$ref": "#/$defs/color" }
      }
    },
    "themes": {
      "description": "In picker order. Ids are unique.",
      "type": "array",
      "minItems": 1,
      "items": { "$ref": "#/$defs/theme" }
    }
  },
  "$defs": {
    "id": { "type": "string", "pattern": "^[A-Za-z][A-Za-z0-9]*$" },
    "unit": { "type": "number", "minimum": 0, "maximum": 1 },
    "color": {
      "description": "An sRGB color with 0...1 components: white for a gray, or red, green and blue. Opacity defaults to 1.",
      "oneOf": [
        {
          "type": "object",
          "required": ["white"],
          "additionalProperties": false,
          "properties": { "white": { "$ref": "#/$defs/unit" }, "opacity": { "$ref": "#/$defs/unit" } }
        },
        {
          "type": "object",
          "required": ["red", "green", "blue"],
          "additionalProperties": false,
          "properties": {
            "red": { "$ref": "#/$defs/unit" },
            "green": { "$ref": "#/$defs/unit" },
            "blue": { "$ref": "#/$defs/unit" },
            "opacity": { "$ref": "#/$defs/unit" }
          }
        }
      ]
    },
    "theme": {
      "type": "object",
      "required": ["id", "name", "summary", "family", "accents", "typeface", "motion", "controls", "surfaces", "palette"],
      "additionalProperties": false,
      "properties": {
        "id": { "$ref": "#/$defs/id" },
        "name": { "type": "string", "minLength": 1 },
        "summary": { "description": "One line for the picker.", "type": "string", "minLength": 1 },
        "family": {
          "description": "The picker group every build reads: calm hardware-black looks, or warm soft looks made for studying. Stays one of these two so builds from before group still decode the file.",
          "enum": ["classic", "cozy"]
        },
        "group": {
          "description": "The picker group in builds that know it, in place of family: sweet for the milk, candy and soda themes. Optional; a value a build does not know falls back to family.",
          "enum": ["sweet"]
        },
        "accents": {
          "description": "What the theme does to each module's accent: keeps it, grays it, saturates it (lifted to 4.5:1 on black) or mixes it toward warm cream. With a palette accent it still colors what tells modules apart, and builds from before palette accents use it for everything.",
          "enum": ["original", "monochrome", "vivid", "pastel"]
        },
        "typeface": { "description": "SF Pro Rounded or SF Pro.", "enum": ["rounded", "standard"] },
        "motion": {
          "description": "gentle plays every spring 30% longer with 0.08 less bounce.",
          "enum": ["standard", "gentle"]
        },
        "controls": {
          "description": "What icon buttons and the tab bar selection sit on: the palette's surface, or Liquid Glass where the system has it.",
          "enum": ["solid", "glass"]
        },
        "surfaces": {
          "description": "What cards are drawn as: the palette's surface, or frosted glass under the glass sheen.",
          "enum": ["flat", "glass"]
        },
        "palette": {
          "type": "object",
          "required": [
            "background", "surface", "surfaceHover", "stroke", "primaryText", "secondaryText", "tertiaryText",
            "success", "warning", "danger"
          ],
          "additionalProperties": false,
          "properties": {
            "background": { "description": "The panel body, opaque.", "$ref": "#/$defs/color" },
            "glow": {
              "description": "A soft color rising from the panel's bottom edge. Absent for a flat body.",
              "$ref": "#/$defs/color"
            },
            "surface": { "$ref": "#/$defs/color" },
            "surfaceHover": { "$ref": "#/$defs/color" },
            "stroke": { "$ref": "#/$defs/color" },
            "primaryText": { "$ref": "#/$defs/color" },
            "secondaryText": { "$ref": "#/$defs/color" },
            "tertiaryText": { "$ref": "#/$defs/color" },
            "success": { "$ref": "#/$defs/color" },
            "warning": { "$ref": "#/$defs/color" },
            "danger": { "$ref": "#/$defs/color" },
            "accent": {
              "description": "The theme's own key color: the active module's ring, selected tab, primary button and chips wear it in place of the module's accent. Absent to keep each module's accent. Opaque, 4.5:1 on every card.",
              "$ref": "#/$defs/color"
            },
            "onAccent": {
              "description": "Text and symbols on an accent fill. Absent for the background (black), which is what builds from before palette accents draw.",
              "$ref": "#/$defs/color"
            }
          }
        }
      }
    }
  }
}
