{
  "schema": "themes.v1",
  "defaultTheme": "midnight",
  "legacyKitThemes": {"notch": "midnight"},
  "glassSheen": {
    "fillTop": { "white": 1, "opacity": 0.12 },
    "fillBottom": { "white": 1, "opacity": 0.04 },
    "glint": { "white": 1, "opacity": 0.08 },
    "rimTop": { "white": 1, "opacity": 0.5 },
    "rimBottom": { "white": 1, "opacity": 0.08 }
  },
  "themes": [
    {
      "id": "midnight",
      "name": "Midnight",
      "summary": "Hardware black, calm and crisp.",
      "family": "classic",
      "accents": "original",
      "typeface": "rounded",
      "motion": "standard",
      "controls": "solid",
      "surfaces": "flat",
      "palette": {
        "background": { "white": 0 },
        "surface": { "white": 1, "opacity": 0.07 },
        "surfaceHover": { "white": 1, "opacity": 0.12 },
        "stroke": { "white": 1, "opacity": 0.08 },
        "primaryText": { "white": 1 },
        "secondaryText": { "white": 1, "opacity": 0.62 },
        "tertiaryText": { "white": 1, "opacity": 0.48 },
        "success": { "red": 0.3, "green": 0.85, "blue": 0.48 },
        "warning": { "red": 1, "green": 0.74, "blue": 0.28 },
        "danger": { "red": 1, "green": 0.38, "blue": 0.36 }
      }
    },
    {
      "id": "graphite",
      "name": "Graphite",
      "summary": "Cool gray surfaces and plain SF type.",
      "family": "classic",
      "accents": "original",
      "typeface": "standard",
      "motion": "standard",
      "controls": "solid",
      "surfaces": "flat",
      "palette": {
        "background": { "white": 0 },
        "glow": { "red": 0.36, "green": 0.38, "blue": 0.42, "opacity": 0.24 },
        "surface": { "red": 0.78, "green": 0.82, "blue": 0.9, "opacity": 0.09 },
        "surfaceHover": { "red": 0.78, "green": 0.82, "blue": 0.9, "opacity": 0.15 },
        "stroke": { "red": 0.78, "green": 0.82, "blue": 0.9, "opacity": 0.12 },
        "primaryText": { "red": 0.94, "green": 0.95, "blue": 0.97 },
        "secondaryText": { "red": 0.88, "green": 0.9, "blue": 0.94, "opacity": 0.72 },
        "tertiaryText": { "red": 0.88, "green": 0.9, "blue": 0.94, "opacity": 0.6 },
        "success": { "red": 0.3, "green": 0.85, "blue": 0.48 },
        "warning": { "red": 1, "green": 0.74, "blue": 0.28 },
        "danger": { "red": 1, "green": 0.38, "blue": 0.36 }
      }
    },
    {
      "id": "liquidGlass",
      "name": "Liquid Glass",
      "summary": "Frosted glass cards over a cool blue glow.",
      "family": "classic",
      "accents": "original",
      "typeface": "standard",
      "motion": "standard",
      "controls": "glass",
      "surfaces": "glass",
      "palette": {
        "background": { "white": 0 },
        "glow": { "red": 0.28, "green": 0.5, "blue": 0.98, "opacity": 0.26 },
        "surface": { "white": 1, "opacity": 0.08 },
        "surfaceHover": { "white": 1, "opacity": 0.14 },
        "stroke": { "white": 1, "opacity": 0.14 },
        "primaryText": { "white": 1 },
        "secondaryText": { "white": 1, "opacity": 0.78 },
        "tertiaryText": { "white": 1, "opacity": 0.64 },
        "success": { "red": 0.3, "green": 0.85, "blue": 0.48 },
        "warning": { "red": 1, "green": 0.74, "blue": 0.28 },
        "danger": { "red": 1, "green": 0.38, "blue": 0.36 }
      }
    },
    {
      "id": "neon",
      "name": "Neon",
      "summary": "Vivid accents with a violet glow.",
      "family": "classic",
      "accents": "vivid",
      "typeface": "rounded",
      "motion": "standard",
      "controls": "solid",
      "surfaces": "flat",
      "palette": {
        "background": { "white": 0 },
        "glow": { "red": 0.55, "green": 0.18, "blue": 0.95, "opacity": 0.22 },
        "surface": { "red": 0.7, "green": 0.8, "blue": 1, "opacity": 0.08 },
        "surfaceHover": { "red": 0.7, "green": 0.8, "blue": 1, "opacity": 0.14 },
        "stroke": { "red": 0.35, "green": 0.95, "blue": 1, "opacity": 0.22 },
        "primaryText": { "white": 1 },
        "secondaryText": { "red": 0.85, "green": 0.92, "blue": 1, "opacity": 0.7 },
        "tertiaryText": { "red": 0.85, "green": 0.92, "blue": 1, "opacity": 0.57 },
        "success": { "red": 0.2, "green": 1, "blue": 0.6 },
        "warning": { "red": 1, "green": 0.85, "blue": 0.2 },
        "danger": { "red": 1, "green": 0.25, "blue": 0.55 }
      }
    },
    {
      "id": "monochrome",
      "name": "Monochrome",
      "summary": "Grayscale everything, no distractions.",
      "family": "classic",
      "accents": "monochrome",
      "typeface": "standard",
      "motion": "standard",
      "controls": "solid",
      "surfaces": "flat",
      "palette": {
        "background": { "white": 0 },
        "surface": { "white": 1, "opacity": 0.07 },
        "surfaceHover": { "white": 1, "opacity": 0.12 },
        "stroke": { "white": 1, "opacity": 0.1 },
        "primaryText": { "white": 1 },
        "secondaryText": { "white": 1, "opacity": 0.62 },
        "tertiaryText": { "white": 1, "opacity": 0.48 },
        "success": { "white": 0.92 },
        "warning": { "white": 0.78 },
        "danger": { "red": 0.95, "green": 0.55, "blue": 0.53 }
      }
    },
    {
      "id": "cozy",
      "name": "Cozy",
      "summary": "Warm cream and peach, soft and gentle.",
      "family": "cozy",
      "accents": "pastel",
      "typeface": "rounded",
      "motion": "gentle",
      "controls": "solid",
      "surfaces": "flat",
      "palette": {
        "background": { "white": 0 },
        "glow": { "red": 0.96, "green": 0.6, "blue": 0.42, "opacity": 0.18 },
        "surface": { "red": 1, "green": 0.93, "blue": 0.84, "opacity": 0.08 },
        "surfaceHover": { "red": 1, "green": 0.93, "blue": 0.84, "opacity": 0.14 },
        "stroke": { "red": 1, "green": 0.93, "blue": 0.84, "opacity": 0.1 },
        "primaryText": { "red": 1, "green": 0.958, "blue": 0.904 },
        "secondaryText": { "red": 1, "green": 0.93, "blue": 0.84, "opacity": 0.74 },
        "tertiaryText": { "red": 1, "green": 0.93, "blue": 0.84, "opacity": 0.6 },
        "success": { "red": 0.62, "green": 0.82, "blue": 0.58 },
        "warning": { "red": 0.98, "green": 0.78, "blue": 0.45 },
        "danger": { "red": 0.96, "green": 0.52, "blue": 0.5 }
      }
    },
    {
      "id": "sakura",
      "name": "Sakura",
      "summary": "Cherry blossom pink on warm black.",
      "family": "cozy",
      "accents": "pastel",
      "typeface": "rounded",
      "motion": "gentle",
      "controls": "solid",
      "surfaces": "flat",
      "palette": {
        "background": { "white": 0 },
        "glow": { "red": 0.98, "green": 0.52, "blue": 0.68, "opacity": 0.18 },
        "surface": { "red": 1, "green": 0.91, "blue": 0.94, "opacity": 0.08 },
        "surfaceHover": { "red": 1, "green": 0.91, "blue": 0.94, "opacity": 0.14 },
        "stroke": { "red": 1, "green": 0.91, "blue": 0.94, "opacity": 0.1 },
        "primaryText": { "red": 1, "green": 0.946, "blue": 0.964 },
        "secondaryText": { "red": 1, "green": 0.91, "blue": 0.94, "opacity": 0.74 },
        "tertiaryText": { "red": 1, "green": 0.91, "blue": 0.94, "opacity": 0.6 },
        "success": { "red": 0.62, "green": 0.82, "blue": 0.58 },
        "warning": { "red": 0.98, "green": 0.78, "blue": 0.45 },
        "danger": { "red": 0.96, "green": 0.52, "blue": 0.5 },
        "accent": { "red": 1, "green": 0.62, "blue": 0.69 },
        "onAccent": { "red": 0.3, "green": 0.06, "blue": 0.12 }
      }
    },
    {
      "id": "forest",
      "name": "Forest",
      "summary": "Mossy sage greens, quiet as a walk.",
      "family": "cozy",
      "accents": "pastel",
      "typeface": "rounded",
      "motion": "gentle",
      "controls": "solid",
      "surfaces": "flat",
      "palette": {
        "background": { "white": 0 },
        "glow": { "red": 0.42, "green": 0.68, "blue": 0.46, "opacity": 0.18 },
        "surface": { "red": 0.92, "green": 1, "blue": 0.92, "opacity": 0.08 },
        "surfaceHover": { "red": 0.92, "green": 1, "blue": 0.92, "opacity": 0.14 },
        "stroke": { "red": 0.92, "green": 1, "blue": 0.92, "opacity": 0.1 },
        "primaryText": { "red": 0.952, "green": 1, "blue": 0.952 },
        "secondaryText": { "red": 0.92, "green": 1, "blue": 0.92, "opacity": 0.74 },
        "tertiaryText": { "red": 0.92, "green": 1, "blue": 0.92, "opacity": 0.6 },
        "success": { "red": 0.62, "green": 0.82, "blue": 0.58 },
        "warning": { "red": 0.98, "green": 0.78, "blue": 0.45 },
        "danger": { "red": 0.96, "green": 0.52, "blue": 0.5 }
      }
    },
    {
      "id": "blueberryMilk",
      "name": "Blueberry Milk",
      "summary": "Baby blue and cloud white, like a carton of blueberry milk.",
      "family": "cozy",
      "group": "sweet",
      "accents": "pastel",
      "typeface": "rounded",
      "motion": "gentle",
      "controls": "solid",
      "surfaces": "flat",
      "palette": {
        "background": { "white": 0 },
        "glow": { "red": 0.424, "green": 0.722, "blue": 1, "opacity": 0.26 },
        "surface": { "red": 0.918, "green": 0.961, "blue": 1, "opacity": 0.08 },
        "surfaceHover": { "red": 0.918, "green": 0.961, "blue": 1, "opacity": 0.14 },
        "stroke": { "red": 0.918, "green": 0.961, "blue": 1, "opacity": 0.11 },
        "primaryText": { "red": 0.961, "green": 0.98, "blue": 1 },
        "secondaryText": { "red": 0.918, "green": 0.961, "blue": 1, "opacity": 0.83 },
        "tertiaryText": { "red": 0.918, "green": 0.961, "blue": 1, "opacity": 0.67 },
        "success": { "red": 0.608, "green": 0.89, "blue": 0.71 },
        "warning": { "red": 1, "green": 0.851, "blue": 0.541 },
        "danger": { "red": 1, "green": 0.612, "blue": 0.612 },
        "accent": { "red": 0.62, "green": 0.824, "blue": 1 },
        "onAccent": { "red": 0.043, "green": 0.145, "blue": 0.251 }
      }
    },
    {
      "id": "strawberryMilk",
      "name": "Strawberry Milk",
      "summary": "Candy pink and milk, sweet but never loud.",
      "family": "cozy",
      "group": "sweet",